sentence_id	sentence	sentence_domain	source	is_used	clips_count
41760042a4b2227c454377de38ca4926a70a2508d78ff88059cca99b82aa9473	በካርቱምና ካይሮ መካከል ቢያንስ ሀያ አምስት አውቶብሶች በየዕለቱ ይጓጓዛሉ።		sentence-collector	1	1
4189aa23c84194e801e5f60feb378da88f63d268848d5aaf8cb970a4c407a6be	ክስተቱ የተፈጠረው ትላንት ሲሆን የሩሲያ መገናኛ ብዙኃን እንዳሉት ምርመራ እየተካሄደ ነው።		sentence-collector	1	1
41a4191dd86fa30d722156dfa250eda92e78db4a872256b23ddcd4c65c4296b7	ሰውየውም ያጠመደውን እረኛ ይዞ ወደቤቱ ሄደ፡፡		sentence-collector	1	1
41c5951a797101d9ce79ee64e1d1eb49009487d9919adc83386e987ded84af21	ቤተሰቦቿን ሁሉ በጠረጴዛ ላይ አስቀምጣ የተለያየ ዓይነት ምግብ ነበር የምታዘጋጅላቸው።		sentence-collector	1	1
41e353fad3aba25491bf6d72c919be7ec75ebecca78770e30e76455ed9e1a33b	ለኔዘርላንድስ የምትሮጠው እና የኦሊምፒክ የአምስት ሺህ እና አስር ሺህ ሜትር ሻምፒዮኗ ሲፈን ሐሰን በለንደን ተገኝታለች።		sentence-collector	1	1
4209bb5e9cba017d41d3e596a824615d15fcc0ea82f3971901a1cbc699f3e410	የሚደንቀው ይህን የአንድ ዓመት ፍርድም አልፈጸሙትም።		sentence-collector	1	1
42288af8e139065f39beaa85c4a3465bb3ca7232dcc537e2b16cd8e56afd5062	መንግሥት ገደቡን እንዲያነሳው ከዚህ ቀደም በመገናኛ ብዙኃን ምክር ቤት መጠየቁንም አስታውሷል።		sentence-collector	1	1
423489bba207aa3b0836a25ec4e2f05276fdb1a017b7c1220495cc5ef48c6eaf	ክልከላውን ያደረጉት የኤርትራ ባለስልጣናት መሆናቸውን ለቤተሰቡ ቅርብ የሆኑ ምንጮች ለቢቢሲ ትግርኛ ገልጸዋል።		sentence-collector	1	1
4234fc22d539c236246abff4f17c01fb7c0ef5d559c5cc8a5c621bde92e70216	ፈጥኖ ደራሽ ልዩ ኃይል ስድስት አውሮፕላኖች ዜጎችን ለማስወጣት ጥቅም ላይ እንደዋሉና ከአሜሪካ ጋር እንደተባበረም ገልጿል።		sentence-collector	1	1
4269b22b43f85c540e5a34eeffa357a3f33c19dedc0fd9a0bd902dbc7a90f41f	ይህ ምን ማለት ነው ብለው መንገዳቸውን ቀጠሉ፡፡		sentence-collector	1	1
427ebb948f2a7c65047712f97a4afb7ccf0b974bccca525d3b5599049c341c31	ቀደም ብሎ የአውሮፓ ህብረት ዜጎቹን ከካርቱም ለማስወጣት እቅድ መንደፉን አስታውቆ ነበር።		sentence-collector	1	1
428d839ed85c88ef7158f7ae77bae140a042502dacdd8651c88b0314a2f00622	ቋንቋውን ባይናገሩም እንረዳዋለን የሚሉ ሰዎች ግን አሉ።		sentence-collector	1	1
42d9daa84fa85a26958d357c88b49ac55fa7ddfda8c465d72a8bcf9763ef3a72	ጄኔራል ሰዓረ ሕይወታቸው እስካለፈበት ድረስ የጦር ኃይሎች ጠቅላይ ኢታማዦር ሹም በመሆን አገልግለዋል።		sentence-collector	1	1
42eb53e9872176838d0775cd8af5d582237284fe9614df18598115f9c9b34d42	የበዳዩ በደል ተዘርዝሮ ሂሳብ ወደ ማወራረድ አልተገባም።		sentence-collector	1	1
4311125f05ab0202411bf09ed32e68377ee97dfc1fc6181fb2ac25fb5892edb8	አሰልጣኝ ውበቱ አባተ ከኢትዮጵያ ብሔራዊ ቡድን ዋና አሰልጣኝነት በጋራ ስምምነት መለያየታቸው ተገለጸ፡፡		sentence-collector	1	1
43f01065c4212e48c615e09a99bc19e14febcce06fd13304f431e73301c80c41	እንዲሁም በአደባባይ ልጆቻቸው እና ሚስቶቻቸው እንዲገደሉ አዘዘ ሲል ፍላቪየስ ጆሴፈስ ጽፏል።		sentence-collector	1	1
43f8ec80fae0ea67eef3823cd65224366eda440a9722fa51b9c6a14322039be1	በዩሮፓ ሊግ ደግሞ በተቃራኒው በራሱ ተጫዋቾች ስህተት ተሰናብቷል።		sentence-collector	1	1
4425a0a8c4039e0fcbb70a89279b055ddd0ea80290b6a8edb06565a5ebb0464b	ፕሬዚዳንት ባይደንን ጨምሮ ከፍተኛ የአሜሪካ ባለስልጣናት የጋዜጠኛውን እስር አውግዘዋል።		sentence-collector	1	1
443181e038203ddadcffb60bf404783cb442b96011e4e7b166dc56d8ad56b3d4	ጥጃዋ ናት ከጓዳ የምታንኮሻኩሸው አለችው፡፡		sentence-collector	1	1
44345f08084a9f0833752e0a297c29db0c91b27828cb9c7124e7d679e8ff96fa	መልሶቹን እስከ ነገ ድረስ እንድታመጣ፡፡		sentence-collector	1	1
4443b3bbbf3574333ce282320486ddf43dd6fba1893c0aab99f07619e444cf5d	ወዶ እንኳን ቢሰደድ ከዓመታት በኋላ ወደ ሀገርቤት ሲመለስ ቤት ወይም ሀገር የሚለው ቃል ትርጉም ያጣበታል።		sentence-collector	1	1
44708eb4b3a7c3d0322734f2c63bdb1b1e143706260df68fc0e381c91b4007b7	እንዲህ እያለም ይፈትነው ጀመር፡፡		sentence-collector	1	1
4488d561857a49e43e5b2f50d93f928e23be2d623238a4e5ac2742311b291024	እንዲያመሩ በማድረግ የኢትዮጵያን ሰላም ለማወክ እየተጠቀሙበት መሆኑን ይናገራል።		sentence-collector	1	1
44a7a140f3f800cf3a2eceeb46fae344c4146d0ea85489b207b7e24d9f42ce54	ሆኖም ሚስቱም አልቻለችም፡፡		sentence-collector	1	1
44c882e05797f15a717a81221d59de30535996ca090335eed30209d844c5d8f8	የሰሜን ኢትዮጵያን የእርስ በርስ ጦርነት የተቋጨበት መንገድ አፍሪካ የራሷን ችግር በራሷ መፍታት እንደምትችል ማሳያ ነው		sentence-collector	1	1
450f46c2b4ecee679ffbf479fce31c258a0078243877afc3be89611e7bcdde90	በአውሮፓውያኑ ሁለት ሺ አስራ አንድ ደቡብ ሱዳን ስትገነጠል የመከላከያ ምክትል ሚኒስትር ነበሩ		sentence-collector	1	1
4528187194b61c339480cd6ce373335aba01633c8a98577f1dd65c1118a5eed9	ከምግብ መታቀብ በራሱ ግብ አይደለም።		sentence-collector	1	1
4595635536841f63b8fcf5ff8c234ebe58d50f25cf843fc41be88424f5113086	ባለፈው የአውሮፓ የበጋ ወቅት ማሪያ ራሳቸው ከደቡባዊ ዩክሬን ማሪዩፖል ከተማ አንድ ልጅ በማደጎ ወስደዋል።		sentence-collector	1	1
45db90d198e32390c394b41fd76f2c04d7338ecb875bdcc7974cc2bf13a0e035	የአሜሪካ ጦር አሜሪካውያን ዲፕሎማቶች እና ቤተሰቦቻቸውን ከሱዳን ካርቱም እንዳስወጣ የአሜሪካው ፕሬዝዳንት ጆ ባይደን ተናገሩ።		sentence-collector	1	1
46046dd9bef218a3b7714a17d6087f42f1a2cd6325f852d29b0f796b7a5b0814	ወድ ድል መጓዝ ያለን ብቸኛ አማራጭ ነው ብሏል።		sentence-collector	1	1
461471660d29802ec5107d30740e4a49137c4c2364acaf9accac0c92962de0ba	ወደ ከተማዋ ማዕከል ለመግባትም ተቸግረው ነበር ይላሉ ዶክተሯ።		sentence-collector	1	1
467e3d3f58d550570c705bff1a72fcdc236d714225dfaefed156b3cabf54de15	እነርሱም እንዴት አሉት፡፡		sentence-collector	1	1
4686f91d42c0852d4fdf378fb39f93dbfab7a63b490f235bd785e6ca8c378e07	ንጉሱም ታዲያ ለምን አላመጣችሁትም አላቸው፡፡		sentence-collector	1	1
469659b74f5ce0f2071c6a2c51254d9324c52f8ab5e799713647bd8a304ccc35	የፈረንሳዩዋ ጃኔ ካልሜት ከመቶ ሀያ ዓመት በላይ ኖረው በአስራ ዘጠኝ ዘጠና ሰባት ነው ያረፉት።		sentence-collector	1	1
46a2cba356123b9557d2036a96f772e72b94e1778eb8aafee3fb3d75d8e2b28f	ገሚሱ በተለይም በእርስበርስ በጦርነቱ የተሣተፈው ቦታ ቀይሮ በጎረቤት ሀገራት ጫካዎች ውስጥ የጀመረውን ጦርነት ቀጠለ።		sentence-collector	1	1
46a5322ebd8ab340954261f04cff7b1927151185fc78257d2f5a9c4bcb1e410d	በአራተኛው ወይም በአምስተኛው ቀን ሌሊት ላይ ረሀብ ሊሰማን ይችላል ሰውነት ቶሎ ነው የሚለምደው ይላሉ ቁረይሺ።		sentence-collector	1	1
46af62f9e4463475f58245bd85f2d9d776b017434f0fb038ac67dc81a17fd8a4	በ ስልሳዎቹ ዕድሜ ውስጥ የሚገኙት ፓስተር ተስፋዬ ባለትዳርና የአንድ ልጅ አባት ነበሩ።		sentence-collector	1	1
46b29f4311aeb23585ee8902871f8052055ff044225f256b5782ff5e677e1052	የዩክሬን ኦርቶዶክስ ቤተክርስትያን አባሎቼ ከሩሲያ ጋር ለመተባበራቸው ምንም ማስረጃ የለም ትላለች።		sentence-collector	1	1
46b70f5a9caeac06a34b1db88fbcea5bf8e2b7a17f314f393b18e09a96620661	በወቅቱ የብሔራዊ መረጃና ደኅነት አገልግሎት ምክትል ዳይሬክተር የነበሩት ማጃክ ሁለቱንም ጄነራሎች የሚያውቋቸው በዳርፉር ነበር።		sentence-collector	1	1
46c3bbf3dfcc8696629f6b42b0f9dbe58e8065fe50d95623c0978b32ca173e47	የሱዳንን ሕዝብ ፈቃድ ሊያከብሩና ለሰብአዊ እርዳታ መንገድ ሊከፍቱም ይገባል ሲሉም አክለዋል።		sentence-collector	1	1
46dcef89aaae9e8b08ed9ca9971fadd1ed29f20eb6475a7e7140f6c769072999	የእርሻውም በሬ ስራውን በሰላም ከመስራት ይልቅ በቀንዱ ይወጋዋል፡፡		sentence-collector	1	1
46ed63b2172f9c3b9d1855dac03f6c0dd37dca05fc29bd607e98759c348abb2b	አንዲት ላም አለችኝና እርሷንም ወስዳችሁ ካረዳችኋት በኋላ ቆዳዋን ስጡኝ፡፡		sentence-collector	1	1
47204f4a4ed49a1dd93d4a502cfad6951fde524e682ba01e757734bec7978546	ሃብታሙም ሰው “ወንድ ልጅ አለሽ?” ብሎ ጠየቃት፡፡		sentence-collector	1	1
47325ad130da3bd174760def4dc0ad80eab6f6f190a9a5856638318b134bab5d	ድንበር ሳይገድባቸው ብሄር እና ቀለም ሳይለዩ ላከናወኑት መልካም ስራ በርዕሰ መስተዳድሩ ምስጋና ቀርቦላቸዋል፡፡		sentence-collector	1	1
474fc2a9493a2b6372a68838434bcf2192ac9d50532a0fa15ffdb4a34e3da757	ይህ አንድን ሃገር ለመጠበቅና ለመከላከል አቅም አይሰጥም ሲሉ ያክላሉ።		sentence-collector	1	1
4779352247e8632095e17fa97d6e73cc6a380446f530fa89f9ef6bbbba7c9ede	ነገር ግን እሱን እንደ አደጋ መመልከታቸው በጣም የሚያስደንቅ ነው።		sentence-collector	1	1
477ebb200d68ddb63e7045db21916f9da5af4ce98c902873236a51300868e841	የሱዳን ህዝብ ጥቅም ተከብሮ ማየት ትልቁ ፍላጎቱ መሆኑንም በድጋሚ አረጋግጠዋል፡፡		sentence-collector	1	1
47840b3fa51e5ed0940cee0b7826bbdc8b9383cb1c7ad791b528390f76e38923	ቅድመ ንጋት ፀሐይ ከመውጣቷ በፊት ጾም መያዣው ሰዓት ደግሞ ሱሁር ይባላል።		sentence-collector	1	1
479aa657258284f213c87b486a166780ba371dbcf32793aa35f12aab2c884f95	በዚህም ተስማምተው ድኩላውም ነብሩን ሳይፈራ ኖሮ መወፈርና ነብሩን ማጓጓት ጀመረ፡፡		sentence-collector	1	1
47ac6d91b4edfe49bb05fdfc7f802cb06775f1953e4a1ef75222db098ef13ede	ብሎ ከብቶች ስላሉህ ከብቶችህን ብቻ ከመጠበቅ ባሻገር ስላንተ ለሌላ ሰው ሳልነግር ምስጢረኛህ እሆናለሁ፡፡		sentence-collector	1	1
47c1db11874d6701ebda51aed22d2ba44f622805f044c2ca55f104a4ca93c98b	ልጄ የተቀበረ ፈንጂ ሰለባ እንድትሆን አልፈልግም		sentence-collector	1	1
47e93d60211562f49ce9e47f729cb2b4d57c49834fe61d3ddc45421b04996a20	በኮመንዌልዝ ውድድር የአስር ሺህ ሜትር አሸናፊዋ በአሁኑ ሰዓት ድንቅ አቋም ላይ ትገኛለች።		sentence-collector	1	1
47fa555a00e28a8df47915e5b8975dc42ae0584735e268d5fc23b09854b605af	ስለዚህ እባክህ ቶሎ መጥተህ ሳይለውጡኝ ውሰደኝና አንተም ከሚስት አልባነት ዳን፡አለችው፡፡		sentence-collector	1	1
483039a3c95b859c09da54547a20367a4685f7f26d8eec86f4e5e733f33f0c85	የካርቱም መንግሥት ከተዳከመ ወይም ተገዳዳሪ የፖለቲካ ኃይል ከመጣ ተጽዕኖው ከካርቱም ካይሮ ይደርሳል።		sentence-collector	1	1
483e6d883766ee645b267cd726c53e20a49c0dcaff28c322a7b0cab63765c7c3	ሆኖም ጄነራል ሄምቲ ባለፉት ሁለት እና ሶስት አመታት ራሳቸውን እንደ ብሄራዊ መሪም ነበር የሚያዩት		sentence-collector	1	1
48451d65434cf05a58a6720b11e43cf41780f783cb826239614e9d2cbe1a107d	ከእንዲህ አይነት የእምነት ሰባኪያን ምክር ጋር በተያያዘ በሚፈጸሙ የጾም እና ሌሎች ትዕዛዞች ምክንያት ምዕመናን ተጎድተዋል		sentence-collector	1	1
484b8fb75a75af74509cf9fbce10b348add0784712bbd290a06ae71ab710dc16	ከአንድ የሕንጻ ተቋራጭ ገንዘብ ተቀብለዋል ተብለው ነው ሉላ ለእስር የተዳረጉት።		sentence-collector	1	1
48a13e2836e98c99f8958b5b6f7884f456fa4cba1def14d9c06d1cd8822267ec	ልጆቻቸውም በቋንቋው መግባባት እንፈልጋለን ቋንቋቻን እንዲጠፋ አንፈልግም ይላሉ።		sentence-collector	1	1
48c8e9bc1785a1df4b0d90d731a270d473af08c884863f1a1acc3414dbbfe1e1	ግሩን ለመፍታትም የዓለም አቀፉ ማህበረሰብ የተቀናጀ ጥረት እንዲያደርግ ጥሪ አቅርበዋል፡፡		sentence-collector	1	1
48faba57eef18b1e5aa206bcec56a9a766055879c643576ca5a5181d3168b1b4	ባሏ ቀለበቱን ለሚስቱ ሰጥቷት በጥንቃቄ እንድትይዘው ነግሯት ነበር፡፡		sentence-collector	1	1
4903e19e0479fd79dc0dd59655d79467eb36c0d743295ac1a00d6ecd082e6852	ጸሐፊዋ የሚፈርጀኝ የሚመድበኝ ያኔ ሰቀለኝ ትላለች።		sentence-collector	1	1
49080c7d32649ab76cc5b88ff46e75e346a94b142c36ed3e7062ae645940514c	ሲዲግ እንደሚሉት የአልበሽር አመራሮች በጄነራል ሄምቲ ላይ እምነት የላቸውም		sentence-collector	1	1
491481622ef998679e1c9da5c357db4616bae1010e1b3d66be4ba44acab7ce51	ዜጎች የት እንዳሉ ለኤምባሲው እንዲያሳውቁም መረጃ ተላልፏል።		sentence-collector	1	1
493692515ffa90920499799bec0f440cec287fb58328e95feb616c3867c1c8e6	ይህ ማለት አንደኛው ማሸነፍ አለበት።		sentence-collector	1	1
494abde3848727666f20310df5d2d6a9c610e13e00f8734835d9269889f662e5	ለዚህ ነው ከብቶች እንድትገዛ ገንዘብ የተወልህ ከዚህ በተጨማሪ ሁላችሁም ገንዘብ እንደምታገኙ አመላክቷችኋል አላቸው፡፡		sentence-collector	1	1
49601a247b3efeb0bef813c7b3d738b989c04f90c0d771c25898f7b00a93abb4	በታላቁ የረመዷን ወር መጨረሻ የሚከበረውን የዒድ አልፈጥር በዓልን በሰላምና በመተሳሰብ ተከብሯል		sentence-collector	1	1
4999f90b6a7a96321c6cb63bfe88532ca562e3d4d0d0e5df8e0e70800ba479dc	የአምነስቲ የምሥራቅ እና ደቡብ አፍሪካ ምክትል ዳይሬክተር ፍላቪያ ምዋንጎቪ መናገራቸው ሰፍሯል።		sentence-collector	1	1
49c180a80fd9bcef44045569e50d6d30b92ba2beddfcd0ca6359e581c65cf165	እናትና ቡችላ የህይወት ተምሳሌቶች ናቸው፡፡		sentence-collector	1	1
49cc0d18c03e6afdf3e0d32dcd79e219ffcfc423f8476716740aac1ec23221d3	በተለይ በጠዋቱ ክፍለ ጊዜ የሰውነት እንቅስቃሴ ማድረግ ከባድ ሊመስል ይችላል።		sentence-collector	1	1
49e20bdd87a09c65af0d43de29e0309aa44ed3573a69d7f3e04b6fbcd058403b	በመጨረሻም ተመስገን አለ፡፡		sentence-collector	1	1
49ef0d08b03008795eb5d75c809944e8209b0d86c1f32d47fdeaac77e0e40e3e	ከአፍሪካ ኅብረት ከፍተኛ ተወካዮች መካከል አንዱ በመሆኑን ሁለቱን ተዋጊ ኃይሎች ሲያደራድሩ የነበሩት የኬንያው ፕሬዝዳንት ነበሩ		sentence-collector	1	1
49fb5797ad2a72d7af0e627c3d8ec3b287f03447fed97baf9eb9f89ae5c8fe17	በማግስቱ ጠዋት ተነስቶ ጥሩ ቁርስ በቅቤ ልክ ፍቅረኞች እንደሚያደርጉት ከበላ በኋላ ተነስቶ ሄደ፡፡		sentence-collector	1	1
4a6504cd8c3c38ed95c197867847ef83c652bfadca8e80043747610c87b2cfc5	ይህ ምን ማለት ነው::		sentence-collector	1	1
4a6960487139a386daec039c2372fbc1d0552bf025504f506fe34fcae0ee76ea	ደረቅ ቆዳ በከብቶች የሚቀይር አንድ ሰው አለ፡፡		sentence-collector	1	1
4a6f088109b4b23da4869f8162b93206e1a23e36702e74d140ae55b8e906515d	የጣሊያን ጠቅላይ ሚኒስትር ጆርጂዮ ሜሎኒ በኢትዮጵያ የነበራቸውን የሥራ ጉብኝት አጠናቅቀው ወደ ሀገራቸው ተመልሰዋል፡፡		sentence-collector	1	1
4a7ead8cc87c9809b048207663455e71b6a37098c11676c9bb7dcc4ae0265b6e	ሶስተኛውም ሰው ያንን በሬም ተመልከቱ የእኔን በሬ ይመስላል አለ፡፡		sentence-collector	1	1
4a7ec35640244f03dc15771521f80f391d852ddfce0403733364e6d3a44ede14	ቴምቢ እህታቸው ለዘጠነኛ ዓመታቸው በስጦታ የገዛችላቸው ነጭ ፓላዞ የተሰኘው ሱሪ በአሁኑ ወቅት አለመኖሩ ይጸጽታቸዋል።		sentence-collector	1	1
4a8cf4cd4f93063fc58632b902338d039ebafbcb8d516d97f4c0daae2e34babe	እንደ ዕድል ሆኖ ይህንን ሥራ መሞከሬንም ሆነ የሚያቆመኝ የትዳር አጋር የለኝም።		sentence-collector	1	1
4aa6a5e2cb975d59e69dd9bb1e811f6352890dd5f38b06fbea4b56940d29dd64	በኋላም ሚስትየው ባሏን እህቴ በጣም ናፍቃኝ ስለነበረ አብሬያት መተኛት አለብኝ አለችው፡፡		sentence-collector	1	1
4aaebb2d16658e1ecfe804e9fb6610806c0c2d53819d398ecc9f065ad9b70ea6	ሮማውያን ቅድስት አገርን ከመውረራቸው በፊት የስቅላት ቅጣት ተፈጻሚ ስለመሆኑ የሚናገሩ ምንጮች አሉን ይላሉ ፕሮፌሰር ፔሬዝ።		sentence-collector	1	1
4ab19d7531ffd21bf9dc216861dd0338586a945c2e4adb9aab192d6d64e45458	ጃንጃዊድ በዘር ማጽዳት ጅምላ መድፈርን እንደ ጦር መሳሪያ በመጠቀም ክስ ይቀርብበታል።		sentence-collector	1	1
4af2bef96d7e028602dc42415693f5c2ce80a71dc77dda5d5e0daacf9aa84c46	ስለዚህ የልጁን ውለታ ለመክፈል በመፈለግ አብሯት ወደቤቷ እንዲሄድ ጠየቀችው፡፡		sentence-collector	1	1
4b53988a89db37d15754a9221e509dd013905e8759f73fbb0e131dbe7f90008a	በመሐመድ ሐምዳን ዳጋሎ የሚመራው ሌላኛው የፈጥኖ ደራሽ ልዩ ኃይል በተባበሩት አረብ ኤምሬትስ ይደገፋል።		sentence-collector	1	1
4b664d4b18a65d9a43714724a8c12d448869c6815d22e987912aa59607e0984b	በዘጋቢነት ሲሰራ የነበረው ኢቫን የካተሪንበርግ በተባለች ከተማ በቁጥጥር ስር ከዋለ በኋላ በስለላ ወንጀል ተከሷል።		sentence-collector	1	1
4b6e96ecaed043f98822bd8e791b721b47d7d9addfb747c640d049db19b66636	ይህ ብቻ በቂ ስላልሆነ ለምን አንድ ቀን አብረን አናድርም?”		sentence-collector	1	1
4b9219a82f9acd7a3469e64775e18e2dea9514e0f528a580d05d188edf391520	ታዋቂው የአፋን ኦሮሞ ድምፃዊ ዘሪሁን ወዳጆ ከዚህ ዓለም በሞት ተለየ።		sentence-collector	1	1
4bd3c36d6182b05078aa49c79ad9456d3c892b49431c5de1e35bc7c5a915c673	የሩዋንዳ ቤተሰብ ላይ የተመሠረተ የቅኝ ግዛትና የዘር ማጥፋት ወንጀሎችን ውስብስብ ውጤቶች በአንድ ላይ የሰፋ ነው		sentence-collector	1	1
4be568aab8799038bdcc13ded7277bb4be8014ac6c0d9af55a4b874b9f3e57dd	እርሷም ለዚህም ቢሆን ዘዴ አበጅቻለሁ፡፡		sentence-collector	1	1
4c26f1c61f5a6c4dbeb567ee84f489e1430993341fe9ed13ab86452bf645e50b	በሕይወት ሳለሁ ሊቀብሩኝ ነበር የሞከሩት እንደምንም ተነሳሁ ብለዋል ሉላ በድጋሚ ፕሬዝዳንት ከሆኑ በኋላ።		sentence-collector	1	1
4c3ddc2fcf01b0e069673528de95ae93c626f4c01ed08402c07d4150b67c9899	በቢሾፍቱ ከተማ የኢንዱስትሪ መንደር ሊገነባ እንደሆነ ተገለጸ፡፡		sentence-collector	1	1
4c5847c8aa2342d23c8e290016915ad0a758e07f4471748a5ee0dc26635a2741	በዘርፉ የተሰማሩ የከተማዋ ነዋሪዎችም ባለን ትንሽ መሬት ላይ ቴክኖሎጂን በመጠቀም በመስራታችን ተጠቃሚ ሆነናል ብለዋል፡፡		sentence-collector	1	1
4c8cc01161a16908085d2d28fac04e56cd10524e46e20bd0d8a2be9bfce009f9	በሲዳሚኛ ቋንቋ ባስተላለፉት መልዕክት እንኳን ለሲዳማ አዲስ ዘመን መለወጫ ፊቼ ጫምባላላ በዓል በሰላም አደረሰን ብለዋል።		sentence-collector	1	1
4ca01f3d603f25f85aca1b2f2ea978418aa663b2b65d1b3725163ea9ee6579ce	የግንባታው መሠረተ ድንጋይ መጋቢት ሀያ አራት ሁለትሺ ሶስት በቀድሞው ጠቅላይ ሚንስትር መለስ ዜናዊ ነበር የተቀመጠው።		Custom	1	1
4ca204e6e2994b943a1e7cf685c3f38b2a38fa91062d6ee9832d01a73b001afc	ባልየው ፍቅረኛዋን ሊይዘው ሲሞክር ፍቅረኛው ደግሞ ለማምለጥ ሲሞክር ትግል ተጀመረ፡፡		sentence-collector	1	1
4ca4757e7e4417177265776e17f23c462fa91006487a08eddd2cd315974acdab	የምንኖረው አጭር ጊዜ ሲሆን መሞቻችንን በፍፁም አናውቅም፡፡		sentence-collector	1	1
4ca59f4deda21f24302ffad0816f8caf2f416775e40249a7eaf47393ae444d5d	በየዩኒቨርስቲዎቹ ለእነዚህ ጉዳዮች የተመደቡ ሰዎች አሉ ብቸኛ ሥራቸውም ተማሪዎችን መርዳት ነው።		sentence-collector	1	1
4cd787badf91afa66d213de4075f45af8bf3c95f2b5af89e5c73876acd5a6a20	በዚህ ሁሉ ደግሞ አውራውን ድርሻ የሚይዘው ደግሞ ጥሬ ሥጋ መመገብ ነው።		sentence-collector	1	1
4ceec7b266fdf98da7b7daee514703a28292a1806ea1b028f8f134dba31824ed	በዚህ የተነሳ ለቅሪተ አካሏ ሉሲ ወይም ድንቅነሽ የሚል ስያሜ እንደወጣላት ይነገራል፡፡		sentence-collector	1	1
4cf92d8d614aef2ca5d5db4a634b64f172550305429b5444a305c85979b27cb9	በቀዳሚዎቹ ዘመናት አባታችን አዳም አትብላ የተባለውን ዕጸ በለስ በልቶ የፈጣሪን ትእዛዝ ተላለፈ		sentence-collector	1	1
4d38f2d6bc26efda7a234120d6a569fdf01617fdebe67efd3496d7c85c830080	አሜሪካ እንግሊዝ እና ጃፓንን ጨምሮ በርካታ የውጭ አገራት ኤምባሲዎች ዜጎቻቸውን ከካርቱም አላስወጡም።		sentence-collector	1	1
4d5c37cd58942328da13bf05b56c28ff9165f15bfbdf062394d9c968ba694c98	በረመዳን ወቅት ልምምድ ስታደርግ የነበረችው ሲፈን በመጀመሪያ የማራቶን ውድድሯ ታሸንፋለች ተብሎ አልተጠብቅም ነበር።		sentence-collector	1	1
4d9e79de35f7bd87f0b0468322aa7311a40bc9c30c14e873406d84601a20b565	ይህንንም ተከትሎ ግብፅ እና ሱዳን ለፀጥታው ምክር ቤት ያስገቡት ቅሬታ ላይ ምክር ቤቱ ተወያይቷል።		Custom	1	1
4db7f74c425d747a4234e9ce2337956a5c5c67b1dcf7055f591b10ed0106cd9a	እንኳን ለኢየሱስ ክርስቶስ የትንሣኤ በዓል አደረሰን አደረሳችሁ		sentence-collector	1	1
4dc6097cd557dac760447c1ff63082164bc8e8bbf99f07ca7337b04526ac9794	ተቋራጩ ገንዘቡን ለሉላ ሲልቫ የሰጣቸው በብራዚል ነዳጅ ድርጅት ሥራ እንዲያገኝ በሚል ነበር።		sentence-collector	1	1
4dda062c8cc160840b12976aa6ddd449fe85342f1448243c2141b44ff4bff6bd	ግብጽ የሱዳን ነገር የሚያሳስባት ለዚህ ብቻ አይደለም።		sentence-collector	1	1
4ddb93ee46e8919995f2590d89ceb087731407c75600ee32cd6569fbdbb76cbb	ቃል እንገባልሃለን አሉት፡፡		sentence-collector	1	1
4e7841f82855fdeaf44c567065c5faa9d1e105601305e0fbca19e112779a3a59	አዎ ነገር ግን የነገርኩህን ነገር አልተቀበልክም፡፡		sentence-collector	1	1
4e7a201d635b56b2e644fc1bb300851992ab01f15d29db1961d8d123827065a9	ይህ ሁሉ ሲሆን የሚሰቀለው ሰው ላይ የሚፈጠረው ህመም በቃላት ለመግለጽ የማይቻል አሰቃቂ ነው።		sentence-collector	1	1
4e7dfe490e7300d2db506baf298aca818e3c8c1a1b91f1f2220b98d859254e11	እዚህም እዚያም ሳይሆኑ መሃል ላይ መዋለል።		sentence-collector	1	1
4eab8aa57a076d2f07b6d22a16a2098d75eeefe2bc9c51adeada48bc4e82a9a9	ሌላኛውም ወርቅ ነበረው፡፡ ሶስተኛው ግን መሬት ብቻ ስለነበረው ተበድሎ ነበር፡፡		sentence-collector	1	1
4eabd614190a097a3e1b1f0adfe60f8982885013e7883538eb189bf699dcc809	መድኃኒቶች ከመፈጠራቸው እንዲሁም ከተሻለ አመጋገብ እና አኗኗር ጋር በተያያዘ ሰዎች በሕይወት የሚቆዩበት ዘመን እየጨመረ መጥቷል።		sentence-collector	1	1
4eafa864115fbbf6eca8b961ecd5febd009b14612de96a3ffffd17f8fa645951	ሕይወት ራሷ እንደዋዛ ከዐይን ላይ እልም ብላ ስትሄድ ትታያለች።		sentence-collector	1	1
4edaf5cd88c73a27ffe902c355f1545bd495e91a2e607baf21cd555ce1683849	ልጆቹ አማራጭ አይኖራቸውም ቀኑን ሙሉ ከዱዳ ስልክ እና ብቻውን ከሚለፍፍ ቲቪ ጋር ተፋጠው ይውላሉ።		sentence-collector	1	1
4f6f3e6afd3ca0c73238ffa9ce9f3a32a3589fcfcff7e6dcf95068b4b58fff8a	ቀኒነሳ አርባ ሁለት ኪሎ ሜትር ርቀትን በመሮጥ ምርጡን የግል ሰዓት አስመዝግቧል።		sentence-collector	1	1
