sentence_id	sentence	sentence_domain	source	is_used	clips_count
7df166fcc4bed7204d9918b6d0b0bee2818536bb7edb46e156a4557f65fdc6cf	ቾይ የፕሬዝደንት ፓርክን መልካም ግንኙነት ተጠቅመው ከባለሃብቶች ጋር ሚሊዮን ዶላሮችን በእርዳታ መልክ ማግኘት ችለዋል።		sentence-collector	1	1
7e0889b168f6ee482a89ad792657b08c989fea70422acbf514260666464df90f	ጠቅላይ ሚኒስትሩ እንዳሉት መንግሥት ሸኔ ብሎ ከሚጠራው ታጣቂ ቡድን ጋር ከነገ በስቲያ ይነጋገራል		sentence-collector	1	1
7e13bbc38287141087c4d76b5276aefab17352fd74ed8d9c994ca28e96e61918	እባክህ አድነኝ፡፡		sentence-collector	1	1
7e16e54361ea00992a0722570407d983e2c764b5bc3781faf472b1a6fadc6550	የዩኒቨርስቲ ትምህርት እስኪጠናቀቅ ለአራት ዓመት የትምህርት ክፍያ ይከፍላሉ ስትል ተናግራለች።		sentence-collector	1	1
7e4935d9fcdc6a67aac7c316969193b7c65a3d4fa0664143b3bf6a3e6fecdcd1	ሥራ እንዳትጀምር ቢወተውቱም ኢትዮጵያ የመጀመሪያውን የውሃ ሙሌት በሁለትሺ አስራ ሁለት ክረም ወራት ላይ አካሂዳለች።		Custom	1	1
7e8482c04f0c710efd14eb54cfbf2eb88575e96e346244960a093ecb4fac3850	ዲፕሎማቶች እና ዜጎች በወታደራዊ አውሮፕላኖች ከካርቱም እንዲወጡ ሊደረግ መሆኑን የሱዳን ጦር ባወጣው መግለጫው ማስታወቁ ይታወሳል።		sentence-collector	1	1
7ebe76d1f4283e4714c4f333c7f1b89a3eafafb47f520f1f3b54cdd4824e78d5	ዌስት ሃም ላለመውረድ እንደዚህ አይነት ጨዋታዎችን ማሸነፉ የግድ ነው።		sentence-collector	1	1
7ed434b2b991b43c120a1fbe5fde2253c2701331115ae2dca18013e8a7abb1c5	በቀጣናው የሚስተዋሉ ችግሮች ፈታኝ እየሆኑ መምጣታቸውን ያነሱት ልዩ መልዕክተኛው		sentence-collector	1	1
7f0ea67c44789804de250cf9ea25760d9c9608e87d306277f7a6cb01541502c2	ልጄ ሴት ልጅዎን ሊያገባ ይፈልጋልና እባክዎ ልጅዎን ለልጄ ይዳሩለት ብላ ተማፀነች፡፡		sentence-collector	1	1
7f1679a9504d74d26b5fcaa836ce8155282d5ff6ed05246fcdae87a6706391d2	የሰርጉም ቀን ደረሰ፡፡		sentence-collector	1	1
7f363dcfbe20e3f11cca178ce1996be9aba15d3948b465ac77f9de78cfd420e1	ታዳጊዎቹም የጦርነቱ ውርስ ገፈት ቀማሽ ሆነዋል።		sentence-collector	1	1
7f58bf91f760190e2874bf8a59b9e8e839cb485e1198d786372463937f96f447	ከአራት ወራት በኋላ ተቀብለንሻል የሚሉ ደብዳቤዎችን ከዩኒቨርስቲዎቹ ይደርሳት ጀመር።		sentence-collector	1	1
7f65241c91eb83e26aabfd9dba6bc0875d352c4d7c386fde4052e76c8a36aa1f	ይህ ደግሞ በተዘዋዋሪ በሥነ ልቦና ጤና ረገድ አውንታዊ ተጽእኖ ያሳድራል።		sentence-collector	1	1
7f73d2d69df481e1d675c9fa56e1988cdceec7884d703ec7890ef3c4d2904f03	የሱዳን ህዝብ ከሚወሳባቸው አያሌ መልካም ባህሪያት መሀከል ለጋስነት እና እንግዳ ተቀባይነታቸው ከምንም በላይ ጎልቶ ይጠቀሳል		sentence-collector	1	1
7f73eb9a69fba89707c327e8cfd72bcab7d364fb37aca71f7b689d16a218040b	ባልየውም ለራሱ እንግዲህ ሚስቴ ‹እህቴ› ብላ ወንድ ይዛብኝ መጣች፡፡		sentence-collector	1	1
7f7a17fb2900da668f1bc1ab3f7414cdc9dbbcdf532312586fd7808dc6cfcda8	እነዚህ ሰዎች በዕድሜ የገፉ ሰዎች ከሚያሳዩት የተለዩ ናቸው።		sentence-collector	1	1
7fd9e5b8758e865e79e75001dbed4e16a6ca710b72bd0506778a4b2adca5d216	የፊልም ፕሮዲውሰሯ በበኩሏ የክሊዮፓትራ የዘር አመጣጥ አከራካሪ ነው ብላለች።		sentence-collector	1	1
7fee7677e8b28e6518b837d699e7acc3beb733a51a593ee0dd5a76747e23b2a3	ባልንጀራቸው ቾይ ይባላሉ።		sentence-collector	1	1
7ff67207f4b0d7eb53947a0917f3b9b02b76eed16795b207f7bd2d175c35da1f	ግድግዳዎች ላይ የጦርነት ድሎች እና የጦር ምርኮኞች እንዲሁም ምርኮኞቹ የተገደሉበትን መንገድ የሚያመለክቱ ሥዕሎች ነበሩ።		sentence-collector	1	1
80018a9a542b19b56580ad32cb6159c499e1fac6d4b72f129accacaf4c30ba41	አራት ዓመት ከትምህር ቤት ርቀው የቆዩ ወደ ትምህር ቤት መመለስ ይፈልጋሉ።		sentence-collector	1	1
80268ab02e9f72604fbb3f4a3d010d960a12dc5aec3cd554955d1524fda0b475	ቀጥሎም ይህንኑ ጥያቄ ነብሩን ጠየቀው፡፡		sentence-collector	1	1
806de57f52506d8ec564b8861f90894722a737ce39f1fdb39c574c95775d7c6c	በተደጋጋሚ እየተጣሰ ነው ካለ በኋላ ከሕግ አግባብ ውጪ የታሰሩ ጋዜጠኞች እንዲፈቱ በመግለጫው ጠይቋል።		sentence-collector	1	1
806dee8a10a4e4bc01766f1b57e2fe269298bcf82fa952275c590ff8a48e91d6	ብሎ በድጋሜ አስጠነቀቀው፡፡		sentence-collector	1	1
807befe6a17637de7384053e50f2291d15cca8a40fac378e679ad1e572ac6a83	ቤተ ክርስቲያኗ ችግሩን በሃይማኖታዊ ቀኖና እና ሥርዓትን በጠበቀ መልኩ እንደተፈታም ማስታወቋ ይታወሳል		sentence-collector	1	1
8118330172bedc4dc91e4f410a0e7fc6d8770fbae8e601aaf37abe5888d90114	በልጆች አስተዳደግ በእኛ አገር ብዙ ሰው ትኩረት የሚሰጠው ለሃርድዌር ዕድገታቸውን ነው ይላሉ።		sentence-collector	1	1
8125d357db82b79eb3d5d0480efa67a03f885a6d7f49d258c6b6e13bd3f6b393	“ይህ ተዓምር ነውአሉ፡፡		sentence-collector	1	1
813cf6a74a51db13337fe0fbbd49209478e8c5f097d3a6b224be0114e9c1c54c	በካርቱም ወደ አንድ ሺህ አምስት መቶ የሚጠጉ የህብረቱ አባል አገራት ዜጎች ይገኛሉ።		sentence-collector	1	1
8157a3070f2cea0c17e7ea1394c02a471ecceb11bf5f96985e5a17059eca6d9e	በምሥራቅ አፍሪካዊቷ አገር ታንዛኒያ ውስጥ ንግግር ማካሄድ እንደሚጀምር ጨምረው አሳውቀዋል።		sentence-collector	1	1
818fb75990dee2595edeef0b50a1ddfb54507b0a0e75ac9da0b8d155dca19e28	በአራተኛውም ቀን ይህንኑ አደረገ፡፡		sentence-collector	1	1
8191eb5d62a66c4500488b25f6670845b8a08d197ddd3246f2c6ad96bd8d934d	ከቤተ ክርስቲያናት ማባረር የመንቀሳቀስ መብትን በኃይል መገደብ እና ከሕግ ውጪ እስራት ተፈጽሟል ብሏል።		sentence-collector	1	1
81e1d82c706406db93c2444e8117414dbf24e52ec9e388c8541c0904de9e6319	እናም በሶስተኛ ጉዟቸው እለት እንደተለመደው አሽከርየው ከጌታው ኋላ ኋላ የፃፈውን ማስታወሻ እያነበበ ይከተላል፡፡		sentence-collector	1	1
81fd5b5aa1dd4c90b287c58a1e55fc2ccc6af76b40f2cfb64f2d713efd69ad1e	ወንዶችን ወደ ሴትነት ሴቶችን ወደ ወንድነት የሚቀይር ነገር አለ፡፡		sentence-collector	1	1
821173b96aeeb5d78797c9971863f4f6ff214d0393cc186164dcf1f86373960a	ይህንን እኛም ማድረግ እንችላለን::		sentence-collector	1	1
821335057f20a7cb3dd6cd614d5028fee50be8ad3cda3058c42c01c1979f3a1b	ሰዎች እስከ መቶ ሀያ አምስት እና መቶ ሰላሳም ሊኖሩ ይችላሉ።		sentence-collector	1	1
824bf56bc87150b74a96ed374fc33e5aaedfccc5eb3a1396d14054293aaa5d32	በኦሮሚያ እና በሌሎች አካባቢዎች የተዳከሙ አብያተ ክርስቲያናትን ቋንቋውን በሚያውቁ አገልጋዮች እና በአገልግሎት ማጠናከር		sentence-collector	1	1
8260b1e409b758908589c33c610e3f100279031306dee651e36c9cba2a1413e7	በእርግጥ ማሸነፍ ይገባቸው ነበር።		sentence-collector	1	1
828c611223f66e10004b376ec5e69965751a10646dfc4c5d01cb4b3ed950e095	ከዚህ ሌላ በርከት ያለ ፍራፍሬ እና ወተት ጥሩ ነው።		sentence-collector	1	1
82c77762e4370234a09f21bc279e53c6361dfd1d647a39789581b9ea1e02f542	ሱዳናውያን ከእናንተ መማር ይኖርባቸዋል።		sentence-collector	1	1
82f6050a71b44abf750bf59944982623698dfe69b02e218ee2e039a4c47f0f20	ቢቢሲ ግን ይህንን በገለልተኛ ወገን አላጣራም።		sentence-collector	1	1
831e976824851f091076fb5df49d92a9b5bb0467b1349111b72227a413117181	ዋቢ እንዴት ልጠቅስ?		common voice	1	1
833633fe8f1713db4a3745a108ef2021dc20c966980e4af352aff43d12499ffd	ሶስተኛዋ ላም ደግሞ የምትታለበው ተቀምጣ ነው፡፡		sentence-collector	1	1
8336a3d7d772c5ba40988fce271a7d6cc3fdc36f167523d650ced88420ec60e4	እውቅና ከተሰጣቸው ሃይማኖቶች ውጪ ያሉ እምነቶች የምዕራባውያን አጀንዳ ማስፈጸሚያ ናቸው ይላሉ።		sentence-collector	1	1
83890bdc9544bc00b548c9dee88e87e4ac9cfcc01bc865193afb2dd375eaeebb	የሩዋንዳ እልቂት ተጠናቅቆ ሙዚየም ተሰርቶለታል		sentence-collector	1	1
83aadd04b5ca2f3eb058a56d53417871c4452066cef14db4c6ab0a693baa99e8	ጆሴፋ በአብዛኛው የሕይወት ዘመናቸው ሲጋራ አጭሰዋል።		sentence-collector	1	1
83bb376c15e9950bcb26dcc334105382c8ab616d0e9ee01afb294f68357654b2	ከጎረቤት አፋር እና አማራ ክልሎች ጋር ግጭት ሊኖር አይገባም ብለዋል።		sentence-collector	1	1
83ce14686eeeafc7ffbc409c3439e6b012481f43476385c21881fb728a666104	በደብሊን ነዋሪ የሆነችው ሬቤካ ፓውደርሊ ከወር አበባ ህመም ስቃይ በተጨማሪ ኢንዶሜትሪዮሲስ የሚባል የጤና ችግርም አለባት።		sentence-collector	1	1
83d7c789ba0051ffafe999d6b6ea8ead1415dbc634a2c386205921684922114a	ከሊጉ እንደማይወርዱ ይሰማኛል።		sentence-collector	1	1
83d89d8a8124cc5d6f170f61d14bd76d822df2c93133d65ba40a3345c7f83fc2	ስለ ዲሞክራሲ አስፈላጊነት አጽንኦት በመስጠት ሲናገሩ ይሰማል ጄኔራል ሄምቲ።		sentence-collector	1	1
83db4c4a862b19dc56bc6442dc9ddf94c3b6ddbb8214aeae2753ae36d50f3482	ፈጽሟል የተባለው ግለሰብ ደግሞ የሩሲያ ወታደሮች መለዮ የሆነውን በእግር ላይ የሚጠለቀውን ነጭ አርማ ለብሶም ይታያል።		sentence-collector	1	1
83ee1a1e5dacbc6dd2ba591ea2551765acfe6668a458aadfe90a8a1d00794a4c	አለችው እርሱም ከእንግዳዋ ጋር ተሳስሞ ተዋወቁ፡፡		sentence-collector	1	1
83f6978f8bf42e9904828e32edfeee4fe9d374c2f59efe18fbd7eddd2fd93ae7	ሚሰቱ ስለምትበሳጭ ጓደኛውን ለቡና ወደቤቱ ለመጋበዝ ይፈራል፡፡		sentence-collector	1	1
83fe1478c745ea2ed6d651e8d9f74b38866502dcd7f9e4579b646aa82998609c	መኖር ያለበት ሕዋስ ጋር የሚመሳሳል ሕዋስ በሌላ የሰውነት ክፍል ውስጥ ለምሳሌ በፊኛ ዙሪያ ሲበቅል ነው።		sentence-collector	1	1
8405b993421b38549f26a9edafa78cbe234124ea3b0dda1cd414b59162bb9c38	ለወደፊቱ በዚህ አደገኛ ሥራ መሰማራቴን የሚቀበል ወንድ እፈልጋለሁ ስትልም በሳቅ በታጀበ ሁኔታ ተናግራለች።		sentence-collector	1	1
840cbf12ec9f5924aa675e41a07ad98aab731332bc635c0c55f46c42a98b4793	በሱዳን መደበኛ ጦርና ፈጥኖ ደራሽ ልዩ ኃይሉ የሚደረገው ፍልሚያ ተፋፍሞ እንደቀጠለ ነው።		sentence-collector	1	1
842a5adbaad79de1a1164e197911a5f52e53f6b65b85018d50f54c1963e18e15	መስዋዕት እየከፈለች እንደሆነ እንዲሁም ሕይወቷን አደጋ ላይ የጣለ ሥራ እየሰራች እንደሆነ ለመረዳት ገና ህጻን ናት።		sentence-collector	1	1
84596dbbe8639e4640227f62deaf507fec04ec6c77cb772e36287258c92f92d3	ለአእምሮ ጤናም በጎ ነው።		sentence-collector	1	1
847ee3a2151e59be15af3bda86baf96b873024613f513091abfafe382ec2ae49	በተደረገ ፍተሻም ሰዎቹ ወታደራዊ ዩኒፎርም የሚለብሱበት ቦታ እንደተገኘ ከንቲባው ጨምረው ገልፀዋል።		sentence-collector	1	1
848a9f4fdc601493c7655b5fb9d532b8889b37a88baef27f2f4645dfaadddf16	አብዛኛው ድሃ መሄጃ የለውም።		sentence-collector	1	1
848ceccb5be6a4bcf5af99bcd85542c81678c30dea97726c3bb368b385aa963d	ናጂብ እኔ አማካሪዬ አሳስቶኝ ነው እንጂ ንጹህ ነኝ ይላሉ።		sentence-collector	1	1
853b8dbac1372ef370d34a92008adb18122450a5a848511b2816c5e8760e0a01	እሷንም አያቱንም ተሸክሞ የማሻገር ኃላፊነት ጫንቃው ላይ ወደቀ።		sentence-collector	1	1
8544c3a72d5c7d7a3834060523ed9aca5c10ee1051bf968a28e500641fdd8eb0	ወታደራዊ ሥልጠና እና ትጥቅ ያላቸው በአስር ሺህዎች የሚቆጠሩ ታጣቂዎችን ባለፉት ዓመታት አደራጅተዋል።		sentence-collector	1	1
85598a01d0e6bfd2efee7134fd1fb61dda075a0b03f976c5b6bda9ba9edda8a3	የቢቢሲው የእግር ኳስ ተንታኝ ክሪስ ሱቶን የተጠባቂዎቹን ጨዋታዎች ግምት እንደሚከተለው አቅርቧል።		sentence-collector	1	1
85712b6b1ff838d3d42987a99fadb28a474851c5ba49618791ebccaa35adac48	ምክር ቤቱ በጀነራል ቡርሃን የሚመራ ሲሆን ምክትሉ ደግሞ ጄነራል ሄምቲ ሆኑ።		sentence-collector	1	1
8582865e66a579164c710b0ef39dfdab464c791488b4bd2a45fddd7ed252e2f0	እናቶች በተለይ የመጀመሪያ ልጃቸውን ከወለዱ በኋላ በአጭር ወራት ውስጥ ወደ ሥራ እንዲመለሱ ይገደዳሉ።		sentence-collector	1	1
8583338653a9b960f53742fc3988df48ca78c7d39e53d7a93ac3e85420922f0b	የተቀበለው ስቃይ እና ሞት እጅግ አሰቃቂ ቢሆንም በዕለተ እሁድ ሞትን ድል አድርጎ በመነሳት ትንሳኤው ተበስሯል።		sentence-collector	1	1
85a40984bc41b365c42e62ccef8bf6693d6f13574590d9baa5c28eb4bad9decb	ከዚህም በተጨማሪ ባለቤቷ እና አሰልጣኟ ከጦርነቱ ጋር በተያያዘ ለእስራት ተዳርጎ ነበር።		sentence-collector	1	1
85c4a473913edfe7f24a34673406f640c060396f43896f41898d34f712b74c68	ወንበሬን ሶስት ጊዜ አምጭልኝ ስላት አመጣችልኝ፡፡		sentence-collector	1	1
862394d23852cdea2d338f4025fe7d39e39ce91485abf7b58a8826a731e94d28	የመልዕክቱ ሙሉ ቃል እንደሚከተለው ቀርቧል		sentence-collector	1	1
865ddaabcacfcfcf41ebd2596f5febe99932bf20ab3849bf5189127377e6f396	አራቱ የማኅበረሰብ መሪዎች እና ታጋዮች የሚያደርጉት የፀረ አፓርታይድ እንቅስቃሴ በፖሊስ ይታወቅ ነበር።		sentence-collector	1	1
86a3488750062339a3fb2b64a0a085c703bf52f905c8d370f6460f80d0db04bb	በኢትዮጵያ ኦርቶዶክስ ቤተ ክርስቲያን የተከሰተውን ችግር ለመፍታት የተላለፉ ውሳኔዎች ምንድን ናቸው?		sentence-collector	1	1
86b13722f6ce98c20ac7caced6aa1fb5f7c70a18776a808e1b3bf769438eda12	ይህም ለሮማውያን በጀርመን ጎሳዎች አሳፋሪ ሽንፈትን ያሳየ ነበር።		sentence-collector	1	1
86cba7d206459a794f4fdf656efb9b2ff7dfa2be50f5b6be68c1558dd5f85096	ይህ የተኩስ አቁም ስምምነት በአሁኑ ሰዓት እጅግ በጣም ወሳኝ ነው ብለዋል ጉተሬዝ።		sentence-collector	1	1
86e073d68506b5c20ff0135d5df5dd1e65bfd48f2594b1ec16be7147030aced1	ዕድሜያቸው ወደ መቶ የተጠጋ ወይም ያለፈ ሰዎች ቁጥር በመላው ዓለም እየጨመረ መጥቷል።		sentence-collector	1	1
86fccee12bfc19c7d7def78a96e074a1461bc4be288b491ff5c09833fc9bc4b1	ሚስቱ ውሽማ ነበራትና ውሽማዋ ወደቤቷ እንዲመጣ ስለፈለገች አንድ ዘዴ ቀየሰች፡፡		sentence-collector	1	1
870cf90ad302f816db4ee4e0145ac2166b25b7cdc065da18639f5ba16b4a2ce6	ለአምስት ዓመታት ያህል ሥራ አጥ ነበርኩ።		sentence-collector	1	1
87212d383a00d2bcc67a3b76c40f2dedd6dcb681bda3d7a9a3ed1e85fbd59f9b	ሆኖም ጄነራል ቡርሃን አክራሪ ሙስሊሞችንና የቀድሞ አገዛዝ አመራሮችን ወደ ቀደመ ቦታቸው መመለስ ጀመሩ ሲሉም ተናግረዋል።		sentence-collector	1	1
873f89a24ceff3f504d54f825e96937a5340f294f536bd82638dd8953e67478e	አንድ ሰው አንድ ሳምቡሳ በልቶ ያቆማል ተብሎ አይታሰብም።		sentence-collector	1	1
87437589398542418feb8974534d39978880feb2ecc4e427d13332b31a5d1f4e	የባሕል እና የልምድ ጉዳይ ሆነና በልጆች ዕድገት ውስጥ የአባቶች ተሳትፎ የሳሳ ነው።		sentence-collector	1	1
8745e07fbabdb4e48e7e8754a7162358322291d940acc0959832356a5091b929	የኢየሱስ ክርስቶስ ትንሣኤ ለሰው ልጅ ደኅንነት ሰላም የተገኘበት መሆኑን የሃይማኖት አባቶች ገልጸዋል፡፡		sentence-collector	1	1
876fd9dadac6db255fc2c04f99a9eeeb3d020a6c728027b66c2bee641d31dced	በዚህም የተሰቀሉት ሰዎች የእግራቸውን ጡንቻ ተጠቅመው መተንፈስ ስለማይችሉ ሞታቸው ይፋጠናል ይላሉ ፕሮፌሰር ፔሬዝ።		sentence-collector	1	1
878c3c1d9790d7194d5ab2c779c4443d28d4493d6856c35027245e5f6466e111	በምትኩ ግን አመድ አኖሩልኝ፡፡ ይህ የሌቦች አገር መሆን አለበት፡፡		sentence-collector	1	1
8794a6f32d8f6e1c9dbc5c42746845546851441acfd52e479a1b394ebfd57d18	ትኩረትን መስጠት መንፈሳዊነትን ማጎልበት በጥሞና ዘለግ ላለ ሰዓት መቆየት እና ራስን ማሻሻል ነው ይላሉ በመጽሐፋቸው።		sentence-collector	1	1
87cbd9ba56e9cc662ce117eef3100c2e63b9b9b0bb42cc91d161058b3198dff0	የልጅ ልጄ ደግሞ ፈረሱን እንኳን ቢይዘው ፈረሱ መጥቶ ይረግጠዋል፡፡		sentence-collector	1	1
87e98cfa9ce8902ba49ccdd783ec79def785fbaa2b1dc83abbeadcc8e4302194	ከዚያም ወደ ቤቷ ወስዳው ከተራራ ላይ የሚዘራውን ዘር ሰጠችው፡፡		sentence-collector	1	1
887add09f4c23ce2f0294168f6c89dd9650f3f565289cdeda058190f31823523	በሙከራ ደረጃ ያለው እንክብል ለሰዎች ከመሰጠቱ በፊት ጥንቸሎች ላይ በርከት ያሉ ሙከራዎች ይደረጋሉ።		sentence-collector	1	1
88a7f67a74261f4c59d5a4aec5691f39c6d99237e99fe1f58993b940ff92f06a	የኢትዮጵያ ብልጽግና እውን ከመሆን አይቀርም የምንለው ጉዞው ቀላል እንደማይሆን በማመን ነው።		sentence-collector	1	1
88c9f200c5badcb67370e754f4ef891010ff543f00114530c61a0fb0aca40ede	ከመሞቱም በፊት እንዳንጣላ ቃል አስገብቶን ስለነበረ አልተጣላንም፡፡		sentence-collector	1	1
88fc9ab2712cd5ae811b091d05b6ad8479fe55f02808e2a9e657e09d6667ac0b	ሕገወጥ ነው የተባለ ሹመት ከሰጡ በኋላ ባለፉት ሳምንታት በአገሪቱ ውስጥ የጎላ ውጥረት ሰፍኖ ቆይቷል።		sentence-collector	1	1
89593d4c2eb39f99ce4f033c449209d91f966b3c4d603debd2e86001caef34e9	ወደ ሶስተኛ ወገን ከመውሰድ ጀምሮ አራተኛ አደራዳሪ እንዲኖር እስከመጠየቅ ደርሰውም ነበር።		Custom	1	1
8959e5ca9686eddb5fe55d43eb6481907d13a1475243f69c05bc982e46a6a071	ብያኔና ፍረጃ ማግለልን ወለደ።		sentence-collector	1	1
896070bc1e4efd0eab44231c694ac7658d86266e76b60930ec0717a0529aa93b	ምን ነካት እያለ ያስብ ጀመር፡፡		sentence-collector	1	1
89b32f382d6c6d5a46d234b1f2e256a6d91798dcb99f3eacd3daaae798741ee2	ከሁለት ዓመት በፊት በኔትፍሊክስ በተላለፈ ዘጋቢ ፊልም ላይ የስፖርተኛው ባለቤት ኮሪና አብረን በቤታችን እየኖርን ነው።		sentence-collector	1	1
89f5323df69544862f59c73016e019c69a4d96c3ff1ba855f19aa40808be2f9e	ነገር ግን አፓርታይድ በሚገረሰስበት ዋዜማ በአውሮፓውያኑ ሌላ ምርመራ ተከፈተ።		sentence-collector	1	1
89fe34119696573117c33871294da7fccb3a80d4fba4239462070b6fe8629934	የሹማከር ቤተሰቦች በመጽሔቱ ኅትመት የተሰማቸውን ቁጣ ገልጸው ጉዳዩን ወደ ፍርድ ቤት እንደሚወስደው አስታውቋል።		sentence-collector	1	1
8a1cebfe30aa5f20e2a294d6f7cd7b6adaf7cde1a30dcccb5281385af851ace8	ነገር ግን አዋቂ የሚያልፍባቸውን ስሜቶች ሁሉ ልጆችም ያልፉባቸዋል።		sentence-collector	1	1
8a42d3804db96030c07deffeed4aa7aaa0da5afb720e05912105233e220d6520	ምክንያቱም ላሟ የጋራ ንብረታቸው ናት፡፡		sentence-collector	1	1
8a51e06839c88ca9d555399f39110bf9f958219095126c0a8a3d331eebbd96dd	ከዚህ ጉዳይ ጋር የሚነሳው ሌላው ተጓዳኝ ጉዳይ ግን የእናቶች ጭንቅ ነው።		sentence-collector	1	1
8a5ee4a4d041c846615bca16a2c55d61fc2ec6faffbe46363635511e4b30f31c	ባለከብቱ ከብቶቹን የሚያበላቸው የግጦሽ መሬት ስላልነበረው ሌላኛውን ወንድሙን ጠየቀ፡፡		sentence-collector	1	1
8a6095eca1e7bcc7358a64e9f6ebc7162857ba5b2115be9e6a30ae2c4d428b2e	ዕርቅ አውራጁም እሱ ይቅር ባዩም እሱ ነው።		sentence-collector	1	1
8a9ad4d9e0243d50afc20f58c0b777596e049080885b75eb244cb8763867632f	የመስተንግዶው ዕቅድ የሚጸድቅ ከሆነ ሞሮኮ ከደቡብ አፍሪካ ቀጥላ ከአፍሪካ የዓለም ዋንጫን በማስተናገድ ሁለተኛዋ አገር ትሆናለች		https://www.bbc.com/amharic/articles/c1dknj42klvo	1	1
8aa3c49aba5014c9cf7c1fbbe590c25ecf4793a21ebf207a7040b87f8a7295ad	በተጨማሪም በወንዶች ልዑል ገብረ ሥላሴ አራተኛ እና ሰይፉ ቱራ አምስተኛ ደረጃን ይዘው አጠናቀዋል፡፡		sentence-collector	1	1
8ac96ac65359b6a281bb46eaeee2e2ee62df7b2bdf5f66602136a29489cf3d73	ሞራሌስ ሥልጣን ለቀው ከአገር ተሰደው ነው ያሉት።		sentence-collector	1	1
8af950032b29e91de3e6229bdcb16c47f9eb2aabfd4e57b338428d8267874b66	ከብት የሚያረቡ አርብቶ አደሮች ቁጥርም እጅግ ጥቂት ነው።		sentence-collector	1	1
8b10c896ed86ae9e06165ef00892289f559e5f7d7e950c9b311bcd9509c2c3f5	ዳግም በምድራችን የታሪክ ዕዳ የተስፋ ምንዳችንን ቆረጣጥሞ አይብላው።		sentence-collector	1	1
8b2b0a6ac9221fa426f9c48a2c72c12aea9f91f054163307587830a76ac90b80	እንደዚህም ሆኖ ሰውየው ተጨማሪ ማገዶ ለመልቀም መመላለሱን አላቆመም፡፡ አሁንም ሊሸከም ቢሞክርም ያቅተዋል፡፡		sentence-collector	1	1
8b3b74d55afcc022eebf9c6be02259bc04cf9fa73b982dac773d9b4c53f7feca	ነገር ግን ለማሃሲን ዳሃብ እና ለቤተሰቦቿ ከከተማዋ መውጣት የሚታሰብ አይደለም።		sentence-collector	1	1
8b4581a1b5d364c01c77efa258ef31135caae6199d0150c1c1c009b470903ef7	ሁለተኛው ደግሞ በቂ ፈሳሽ መውሰድ ነው።		sentence-collector	1	1
8b736ff87624f70411db94ecb2ee32cf217f89e7bd65fe3b75a5636419151703	ማሳነስ ከሰውነት በታች አርጎ መመልከትን።		sentence-collector	1	1
8b8b682254c2b04c7ffd90cb4db1db0bf851ecc242b4967e470280d95751e2b7	ከእለታት አንድ ቀን ደግሞ አንዲት ቆንጆ ሴት ስታለቅስ ያገኛታል፡፡		sentence-collector	1	1
8b8d72e8db5cb1028915e6f7acac77bbc72966a320d57b6017c495f2f24d402a	በሌሊቱ ክፍለ ጊዜ ያን ለማካካስ ምግብ ማግበስበስ ለጤናም ለመንፈስም ጎጂ ነው ይላሉ እነ ቁረይሺ።		sentence-collector	1	1
8b9244a9f17fd654d4887ac5f59696bc493f1209727a817eb52f6bcda4bb11a1	ለሕዝባችን እና ለአገራችን ጥቅም ስንል ይህንን አዙሪት ልናስቆመው ይገባል በማለትም ምክሯን ለግሳለች።		sentence-collector	1	1
8b95f830ffc4f9afb41281d9ce992cb3311cceac9ffffd0982ad55daef7ba272	ፎቶውን እያነሱ ለነበሩት የጋዜጠኞች ቡድን ምንም አልተናገረም።		sentence-collector	1	1
8bc7d77bd1a7edeb9d88a119f900fccf0bceb64a6ce54a1e1545f8437aebfd6e	እርሱም ጌታዬ ሆይ እንዳነሳው እርስዎም ሆኑ ሌላ ሰው ስላልነገረኝ ነው ዝም ያልኩት አለ፡፡		sentence-collector	1	1
8bec106b53f61ac219103c6e385611e8aa488a68e1da13cad3ed76d9950891c7	ይህም ሁኔታ ትልቅ ለውጥ ያመጣ እንደሆነ የኮሚሽኑ ሥራ አስኪያጅ ካታርዚና ዙዱንቺክ ያስረዳሉ።		sentence-collector	1	1
8ca6f4e19fa36ea62b0e024ec7e49703a172f7e5dbb2df824a37df90ed5feaf0	በአውሮፓውያኑ የተፈጸመው የክራዶክ አራት ግድያ በወቅቱም በመላ አገሪቱ ከፍተኛ ቁጣ የቀሰቀሰ ነበር።		sentence-collector	1	1
8ca845985a4600f3fc574e96ef7b2f8e395cbd3bb8982bd40a4d093b0e2f2d99	ለምንድነው የዋሸኸን? ከብቶች በቆዳ የሚለውጥ ሰው አለ ብለኸን ነበር፡፡		sentence-collector	1	1
8ca9def0ab625c1aade1a64545d1c0a38784cbf33956f3c41201dd8a22da2eca	ኢየሱስ አስቀድሞ ስለሞተ በእሱ ላይ ይህንን አልፈጸሙም።		sentence-collector	1	1
8cc8ab71ae05ea17732c9ee90bd5b2fffe5ea08839a48d1b03d6126cbf054170	ታማኝ የሚባሉት ውሾች በሰው ሥጋ ቁንጣን ተወጥረው እንቅልፍ ተጭኗቸው አለከለኩ።		sentence-collector	1	1
8ce5f61ec571158fc60277fc08fa76e0102ea062bda1dc25b6d386b41d373eaf	የመንግሥታቱ ድርጅት የሰብአዊ መብቶች ምክር ቤት አባል ብትሆንም የሰብአዊ መብቶችን እና የእምነት ነፃነትን በመጣስ ትከሰሳለች።		sentence-collector	1	1
